,number,value,datetime_start,datetime_complete,duration,params_adam_lr,params_optimizer,params_weight_decay,state
0,0,0.3045,2021-08-22 10:01:58.104381,2021-08-22 10:02:33.513054,0 days 00:00:35.408673,0.0025264667017277846,Adam,1.8137676769656906e-05,COMPLETE
1,1,0.4575,2021-08-22 10:02:33.513713,2021-08-22 10:03:09.130369,0 days 00:00:35.616656,1.1041572532180917e-05,Adam,1.753049513446176e-08,COMPLETE
2,2,0.29699999999999993,2021-08-22 10:03:09.131053,2021-08-22 10:03:44.846429,0 days 00:00:35.715376,0.0023000587638057957,Adam,3.852073047003212e-08,COMPLETE
3,3,0.489,2021-08-22 10:03:44.847128,2021-08-22 10:04:18.623855,0 days 00:00:33.776727,0.00013060912985470596,Adagrad,0.0007267522392449595,COMPLETE
4,4,0.599,2021-08-22 10:04:18.624516,2021-08-22 10:04:52.509084,0 days 00:00:33.884568,1.3387004130527245e-05,Adagrad,1.8270006490085908e-06,COMPLETE
5,5,0.4949999999999999,2021-08-22 10:04:52.509743,2021-08-22 10:05:26.026652,0 days 00:00:33.516909,2.5773037049601555e-05,Adagrad,5.622483944576338e-10,COMPLETE
6,6,0.4959999999999999,2021-08-22 10:05:26.027305,2021-08-22 10:06:01.502779,0 days 00:00:35.475474,0.059499307211143916,Adam,1.3028585434168774e-09,COMPLETE
7,7,0.2815000000000001,2021-08-22 10:06:01.503451,2021-08-22 10:06:35.549533,0 days 00:00:34.046082,0.0016595686677013134,Adagrad,2.6645638748050635e-08,COMPLETE
8,8,0.3390000000000001,2021-08-22 10:06:35.550182,2021-08-22 10:07:10.800906,0 days 00:00:35.250724,0.0032222956840659476,Adam,1.3783655387402847e-08,COMPLETE
9,9,0.504,2021-08-22 10:07:10.801613,2021-08-22 10:07:46.398982,0 days 00:00:35.597369,0.03994100079131575,Adam,0.000292871984788713,COMPLETE
