,number,value,datetime_start,datetime_complete,duration,params_adam_lr,params_optimizer,params_weight_decay,state
0,0,0.3045,2021-08-22 09:58:55.033758,2021-08-22 09:59:13.815819,0 days 00:00:18.782061,0.0008257486513158593,Adam,1.9579889180806796e-10,COMPLETE
1,1,0.3075000000000001,2021-08-22 09:59:13.816458,2021-08-22 09:59:32.340206,0 days 00:00:18.523748,0.07152849958450279,Adam,1.8816662289374288e-08,COMPLETE
2,2,0.3035,2021-08-22 09:59:32.340841,2021-08-22 09:59:50.139771,0 days 00:00:17.798930,0.008201568390820502,Adagrad,1.4535660561720567e-09,COMPLETE
3,3,0.5,2021-08-22 09:59:50.140422,2021-08-22 10:00:08.765679,0 days 00:00:18.625257,4.996610286532846e-05,Adam,1.8006151141949032e-10,COMPLETE
4,4,0.5,2021-08-22 10:00:08.766339,2021-08-22 10:00:26.758479,0 days 00:00:17.992140,0.0003030581974921117,Adagrad,8.380007137681661e-10,COMPLETE
5,5,0.3045,2021-08-22 10:00:26.759349,2021-08-22 10:00:45.066261,0 days 00:00:18.306912,0.004759024910465183,Adagrad,1.7107109763620965e-10,COMPLETE
6,6,0.29600000000000004,2021-08-22 10:00:45.067014,2021-08-22 10:01:03.852765,0 days 00:00:18.785751,0.006200866278112672,Adam,9.418362261042739e-10,COMPLETE
7,7,0.30499999999999994,2021-08-22 10:01:03.853424,2021-08-22 10:01:21.660956,0 days 00:00:17.807532,0.009110566526241062,Adagrad,8.210375154897518e-10,COMPLETE
8,8,0.5,2021-08-22 10:01:21.661588,2021-08-22 10:01:39.501263,0 days 00:00:17.839675,0.00011783075377449284,Adagrad,8.656737590989794e-10,COMPLETE
9,9,0.5,2021-08-22 10:01:39.502009,2021-08-22 10:01:58.097562,0 days 00:00:18.595553,1.6971995907558434e-05,Adam,3.8723826142397986e-07,COMPLETE
